mysql> notee
mysql> SELECT Title, Name FROM Album
    -> JOIN Artist ON Album.ArtistID = Artist.ArtistId
    -> LIMIT 5;
+---------------------------------------+-----------+
| Title                                 | Name      |
+---------------------------------------+-----------+
| For Those About To Rock We Salute You | AC/DC     |
| Balls to the Wall                     | Accept    |
| Restless and Wild                     | Accept    |
| Let There Be Rock                     | AC/DC     |
| Big Ones                              | Aerosmith |
+---------------------------------------+-----------+
5 rows in set (0.00 sec)

mysql> DESC Genre;
+---------+--------------+------+-----+---------+----------------+
| Field   | Type         | Null | Key | Default | Extra          |
+---------+--------------+------+-----+---------+----------------+
| GenreId | int          | NO   | PRI | NULL    | auto_increment |
| Name    | varchar(120) | YES  |     | NULL    |                |
+---------+--------------+------+-----+---------+----------------+
2 rows in set (0.00 sec)

mysql> INSERT INTO Genre (Name) VALUES ('Trad');
Query OK, 1 row affected (0.09 sec)

mysql> SELECT LAST_INSERT_ID();
+------------------+
| LAST_INSERT_ID() |
+------------------+
|               26 |
+------------------+
1 row in set (0.00 sec)

mysql> SELECT Name FROM Genre WHERE GenreId = 26;
+------+
| Name |
+------+
| Trad |
+------+
1 row in set (0.00 sec)

mysql> UPDATE Genre SET Name = 'Traditional' WHERE Name = 'Trad';
Query OK, 1 row affected (0.04 sec)
Rows matched: 1  Changed: 1  Warnings: 0

mysql> SELECT Name FROM Genre WHERE GenreId = 26;
+-------------+
| Name        |
+-------------+
| Traditional |
+-------------+
1 row in set (0.00 sec)

mysql> DELETE FROM Genre WHERE Name = 'Traditional';
Query OK, 1 row affected (0.04 sec)

mysql> SELECT Name FROM Genre WHERE GenreId = 26;
Empty set (0.00 sec)

mysql> 